{
  "id": "bridge_ambient_default",
  "category": "ambient",
  "descriptor": "ambient",
  "parameters": [
    {
      "parameter": "reverb_decay",
      "value_range": [0.6, 0.95],
      "typical_default": 0.8,
      "why": "Long decay creates spacious, atmospheric quality"
    },
    {
      "parameter": "reverb_mix",
      "value_range": [0.4, 0.7],
      "typical_default": 0.5,
      "why": "Generous reverb blend without overwhelming the dry signal"
    },
    {
      "parameter": "filter_cutoff",
      "value_range": [0.3, 0.6],
      "typical_default": 0.45,
      "why": "Moderate filtering softens transients for ambient character"
    },
    {
      "parameter": "attack",
      "value_range": [0.3, 0.8],
      "typical_default": 0.5,
      "why": "Slower attack removes transients for pad-like quality"
    }
  ],
  "source": "Sound Design KB",
  "confidence": 0.80,
  "why": "Ambient sounds use reverb, slow attacks, and moderate filtering to create spacious, evolving textures.",
  "anti_patterns": [
    {
      "avoid": "Fast attack with long reverb",
      "reason": "Creates muddy, indistinct sound"
    }
  ],
  "related_descriptors": ["lush", "psychedelic"],
  "example_plugins": [
    {"name": "Valhalla VintageVerb", "how_used": "Long decay, high mix, moderate damping"},
    {"name": "u-he Hive", "how_used": "Slow attack, filtered oscillators, wide unison"}
  ],
  "user_feedback": []
}